<?xml version="1.0" encoding="iso-8859-1"?>
<!DOCTYPE alfs SYSTEM "../DTD/ALFS.dtd"
[
<!ENTITY % general_entities SYSTEM "../config/general.ent">
<!ENTITY % package_entities SYSTEM "../config/package.ent">

%general_entities;
%package_entities;
]>
<alfs>
  <package name="ncurses" version="&ncurses-version;">
    <stage name="Download and Check">
      <download>
	<file>&ncurses-package;</file>
	<url>&ncurses-package-url;</url>
	<destination>&packages_dir;</destination>
	<digest>&ncurses-md5;</digest>
      </download>
    </stage>
    <stage name="Unpacking">
      <unpack>
        <archive>&packages_dir;/&ncurses-package;</archive>
        <destination>&build_dir;</destination>
      </unpack>
    </stage>
    <stage name="Installing">
      <stageinfo>
        <base>&build_dir;/&ncurses-directory;</base>
      </stageinfo>
      <configure>
        <param>--prefix=/usr</param>
        <param>--with-shared</param>
        <param>--without-debug</param>
      </configure>
      <make>
        <param>sources</param>
      </make>
      <make>
        <param>&jlevel;</param>
      </make>
      <make>
        <param>install</param>
      </make>
      <permissions mode="755">
        <name>/usr/lib/*.&ncurses-version;</name>
      </permissions>
      <permissions mode="644">
        <name>/usr/lib/libncurses++.a</name>
      </permissions>
      <move>
        <source>/usr/lib/libncurses.so.5*</source>
        <destination>/lib</destination>
      </move>
      <link>
        <option>force</option>
        <target>../../lib/libncurses.so.5</target>
        <name>/usr/lib/libncurses.so</name>
      </link>
      <link>
        <option>force</option>
        <target>libncurses.so</target>
        <name>/usr/lib/libcurses.so</name>
      </link>
    </stage>
    <stage name="Cleanup">
      <remove>&build_dir;/&ncurses-directory;</remove>
    </stage>
  </package>
</alfs>
