<?xml version="1.0" encoding="iso-8859-1"?>
<!DOCTYPE alfs SYSTEM "../DTD/ALFS.dtd"
[
<!ENTITY % general_entities SYSTEM "../config/general.ent">
<!ENTITY % package_entities SYSTEM "../config/packages/ch35.ent">
<!ENTITY % config_entities SYSTEM  "../config/config.ent">

%general_entities;
%package_entities;
%config_entities;

]>
<alfs>
  <package name="mozilla" version="&mozilla-version;">
    <packageinfo>
      <requires>
        <name>zip</name>
      </requires>
      <requires>
        <name>gtk+2</name>
      </requires>
      <requires>
        <name>libidl</name>
      </requires>
      <utilizes>
	<name>gnupg</name>
      </utilizes>
      <utilizes>
	<name>libjpeg</name>
      </utilizes>
      <utilizes>
	<name>unzip</name>
      </utilizes>
      <utilizes>
	<name>gnome-vfs2</name>
      </utilizes>
      <utilizes>
	<name>libart_lgpl</name>
      </utilizes>
      <utilizes>
	<name>&krb-impl;</name>
      </utilizes>
      <utilizes>
	<name>doxygen</name>
      </utilizes>
      <utilizes>
	<name>xprint</name>
      </utilizes>
      <utilizes>
	<name>electricfence</name>
      </utilizes>
      <utilizes>
	<name>cairo</name>
      </utilizes>
    </packageinfo>
    <stage name="Unpacking">
      <unpack>
        <digest>&mozilla-md5;</digest>
	<archive>&packages_dir;/&mozilla-package;</archive>
        <destination>&build_dir;</destination>
      </unpack>
    </stage>
    <stage name="Installing">
      <stageinfo>
        <environment>
          <variable name="MOZILLA_OFFICIAL">1</variable>
          <variable name="BUILD_OFFICIAL">1</variable>
	  <variable name="MOZ_CO_PROJECT">suite</variable>
        </environment>
        <base>&build_dir;/&mozilla-directory;</base>
      </stageinfo>
      <configure>
        <param>--prefix=/usr</param>
        <param>--with-default-mozilla-five-home=/usr/lib/mozilla</param>
        <param>--with-system-zlib</param>
        <param>--with-system-png</param>
	<param>--enable-application=suite</param>
        <param>--enable-default-toolkit=gtk2</param>
	<param>--enable-extensions=all</param>
	<param>--enable-crypto</param>
	<param>--enable-xft</param>
	<param>--enable-xinerama</param>
	<param>--enable-optimize</param>
	<param>--enable-reorder</param>
	<param>--enable-strip</param>
	<param>--enable-cpp-rtti</param>
	<param>--enable-calendar</param>
	<param>--disable-freetype2</param>
	<param>--disable-accessibility</param>
	<param>--disable-debug</param>
	<param>--disable-tests</param>
	<param>--disable-logging</param>
	<param>--disable-pedantic</param>
	<param>--disable-installer</param>
      </configure>
      <make />
      <make>
        <param>install</param>
      </make>
      <mkdir>
	<option>parents</option>
	<name>/usr/include/mozilla-&mozilla-version;/nss</name>
      </mkdir>
      <execute command="cp -Lf dist/private/nss/*.h dist/public/nss/*.h /usr/include/mozilla-&mozilla-version;/nss" />
      <execute command="ln -nsf mozilla-&mozilla-version; /usr/include/mozilla" />
      <execute command="if [ -d /usr/lib/mozilla/plugins ]; then mv /usr/lib/mozilla/plugins/* /usr/lib/mozilla-&mozilla-version;/plugins; rm -rf /usr/lib/mozilla; fi" />
      <execute command="ln -nsf mozilla-&mozilla-version; /usr/lib/mozilla" />
      <move base="/usr/lib/mozilla-&mozilla-version;">
        <source>libnspr4.so</source>
        <source>libplc4.so</source>
        <source>libplds4.so</source>
        <source>libnss3.so</source>
        <source>libsmime3.so</source>
        <source>libsoftokn3.so</source>
        <source>libssl3.so</source>
        <source>libsoftokn3.chk</source>
        <destination>/usr/lib</destination>
      </move>
      <link>
        <option>force</option>
        <target>../libnspr4.so</target>
        <target>../libplc4.so</target>
        <target>../libplds4.so</target>
        <target>../libnss3.so</target>
        <target>../libsmime3.so</target>
        <target>../libsoftokn3.so</target>
        <target>../libssl3.so</target>
        <target>../libsoftokn3.chk</target>
        <name>/usr/lib/mozilla-&mozilla-version;</name>
      </link>
      <stage name="Multi-User Operation Setup">
        <stageinfo>
          <environment>
            <variable name="LD_LIBRARY_PATH">/usr/lib/mozilla-&mozilla-version;</variable>
            <variable name="MOZILLA_FIVE_HOME">/usr/lib/mozilla-&mozilla-version;</variable>
          </environment>
          <base>/usr/lib/mozilla-&mozilla-version;</base>
        </stageinfo>
        <execute command="./regxpcom" />
        <execute command="./regchrome" />
        <execute command="touch `find . -name *.rdf`" />
      </stage>
    </stage>
    <stage name="Cleanup">
      <remove>&build_dir;/&mozilla-directory;</remove>
    </stage>
  </package>
</alfs>
