<?xml version="1.0" encoding="iso-8859-1"?>
<!DOCTYPE alfs SYSTEM "../DTD/ALFS.dtd"
[
<!ENTITY % general_entities SYSTEM "../config/general.ent">
<!ENTITY % package_entities SYSTEM "../config/packages/ch20.ent">
<!ENTITY % config_entities SYSTEM  "../config/config.ent">

%general_entities;
%package_entities;
%config_entities;

]>
<alfs>
  <package name="procmail" version="&procmail-version;">
    <stage name="Unpacking">
      <unpack>
        <digest>&procmail-md5;</digest>
	<archive>&packages_dir;/&procmail-package;</archive>
        <destination>&build_dir;</destination>
      </unpack>
    </stage>
    <stage name="Installing">
      <stageinfo>
        <base>&build_dir;/&procmail-directory;</base>
      </stageinfo>
      <make>
        <param>LOCKINGTEST=/tmp</param>
        <param>install</param>
      </make>
      <make>
        <param>install-suid</param>
      </make>
    </stage>
    <stage name="Cleanup">
      <remove>&build_dir;/&procmail-directory;</remove>
    </stage>
  </package>
</alfs>
