<?xml version="1.0" encoding="iso-8859-1"?>
<!DOCTYPE alfs SYSTEM "../DTD/ALFS.dtd"
[
<!ENTITY % general_entities SYSTEM "../config/general.ent">
<!ENTITY % package_entities SYSTEM "../config/packages/ch12.ent">
<!ENTITY % config_entities SYSTEM  "../config/config.ent">

%general_entities;
%package_entities;
%config_entities;

]>
<alfs xmlns:xi="http://www.w3.org/2001/XInclude">
  <stage name="Perl modules">
    <!-- Note: Some modules are built in a specific order to satisfy dependencies -->
    <xi:include href="perlmods/Module-Info.xml" />
    
    <xi:include href="perlmods/Pod-Escapes.xml" />
    <xi:include href="perlmods/Pod-Simple.xml" />
    <xi:include href="perlmods/Test-Builder-Tester.xml" />
    <xi:include href="perlmods/Test-Pod.xml" />

    <xi:include href="perlmods/Extutils-CBuilder.xml" />
    <xi:include href="perlmods/Extutils-ParseXS.xml" />
    <xi:include href="perlmods/Compress-Zlib.xml" />
    <xi:include href="perlmods/IO-Zlib.xml" />
    <xi:include href="perlmods/Archive-Tar.xml" />
    <xi:include href="perlmods/YAML.xml" />
    <xi:include href="perlmods/Module-Build.xml" />

    <xi:include href="perlmods/HTML-Tagset.xml" />
    <xi:include href="perlmods/HTML-Parser.xml" />

    <xi:include href="perlmods/XML-Parser.xml" />

    <xi:include href="perlmods/SGMLSpm.xml" />

    <xi:include href="perlmods/Tk.xml" />

    <xi:include href="perlmods/Digest-SHA1.xml" />
    <xi:include href="perlmods/Digest-HMAC.xml" />
    <xi:include href="perlmods/Net-IP.xml" />
    <xi:include href="perlmods/Net-DNS.xml" />

    <xi:include href="perlmods/Module-CoreList.xml" />
    <xi:include href="perlmods/Test-Prereq.xml" />
    <xi:include href="perlmods/Business-ISBN-Data.xml" />
    <xi:include href="perlmods/Business-ISBN.xml" />
    <xi:include href="perlmods/URI.xml" />
    <xi:include href="perlmods/Crypt-SSLeay.xml" />
    <xi:include href="perlmods/LWP.xml" />

    <xi:include href="perlmods/DateManip.xml" />

    <xi:include href="perlmods/HTML-TableExtract.xml" />
    <xi:include href="perlmods/Finance-Quote.xml" />

    <xi:include href="perlmods/Text-CSV_XS.xml" />
    <xi:include href="perlmods/Finance-QuoteHist.xml" />

    <xi:include href="perlmods/Digest-SHA.xml" />
    <xi:include href="perlmods/PAR-Dist.xml" />
    <xi:include href="perlmods/Module-Signature.xml" />
        
    <xi:include href="perlmods/Digest-BubbleBabble.xml" />

    <xi:include href="perlmods/Socket6.xml" />
    <xi:include href="perlmods/IO-Socket-INET6.xml" />
    

  </stage>
</alfs>
