<?xml version="1.0" encoding="iso-8859-1"?>
<!DOCTYPE alfs SYSTEM "../DTD/ALFS.dtd"
[
<!ENTITY % general_entities SYSTEM "../config/general.ent">

%general_entities;
]>

<alfs>
  <stage name="Creating $LFS/cross-tools">
    <stageinfo>
      <user>&lfs-user;</user>
    </stageinfo>
    <mkdir>
      <option>parents</option>
      <name>&lfs-user-dir;/cross-tools</name>
    </mkdir>
  </stage>
  <stage name="Creating /cross-tools">
    <link>
      <option>force</option>
      <target>&lfs-user-dir;/cross-tools</target>
      <name>/</name>
    </link>
  </stage>
<!--
  $LastChangedDate$
  $LastChangedBy$
  $LastChangedRevision$
-->
</alfs>
