<?xml version="1.0" encoding="iso-8859-1"?>
<!DOCTYPE alfs SYSTEM "../DTD/ALFS.dtd"
[
<!ENTITY % general_entities SYSTEM "../config/general.ent">
<!ENTITY % package_entities SYSTEM "../config/packages/ch18.ent">
<!ENTITY % config_entities SYSTEM  "../config/config.ent">
<!ENTITY % files SYSTEM "../config/files.ent">

%general_entities;
%package_entities;
%config_entities;
%files;

<!ENTITY bootscripts-get SYSTEM "../config/bootscripts_get.ent">
<!ENTITY bootscripts-clean SYSTEM "../config/bootscripts_clean.ent">

]>
<alfs>
  <package name="ncpfs" version="&ncpfs-version;">
    <packageinfo>
      <utilizes>
        <name>linuxpam</name>
      </utilizes>
      <utilizes>
        <name>php</name>
      </utilizes>
    </packageinfo>
    <stage name="Unpacking">
      <stageinfo>
	<user>&build-user;</user>
      </stageinfo>
      <unpack>
        <digest>&ncpfs-md5;</digest>
	<archive>&packages_dir;/&ncpfs-package;</archive>
        <destination>&build_dir;</destination>
      </unpack>
    </stage>
    &bootscripts-get;
    <stage name="Building">
      <stageinfo>
        <base>&build_dir;/&ncpfs-directory;</base>
      </stageinfo>
      <configure>
        <param>--prefix=""</param>
        <param>--includedir=/usr/include</param>
        <param>--mandir=/usr/share/man</param>
        <param>--datadir=/usr/share</param>
      </configure>
      <make />
    </stage>
    <stage name="Installing">
      <stageinfo>
	<base>&build_dir;/&ncpfs-directory;</base>
      </stageinfo>
      <make>
        <param>install</param>
      </make>
      <make>
        <param>install-dev</param>
      </make>
    </stage>
    <stage name="Installing bootscript and configuration">
      <stageinfo>
        <base>&build_dir;/&blfs-bootscripts-directory;</base>
      </stageinfo>
      <make>
        <param>install-service-ipx</param>
      </make>
    <copy>
      <source>&blfs-config;/etc/sysconfig/network-devices/ifconfig.eth0/ipx</source>
      <destination>/etc/sysconfig/network-devices/ifconfig.eth0/ipx</destination>
    </copy>
    </stage>
    &bootscripts-clean;
    <stage name="Cleanup">
      <remove>&build_dir;/&ncpfs-directory;</remove>
    </stage>
  </package>
</alfs>
