<?xml version="1.0" encoding="iso-8859-1"?>
<!DOCTYPE alfs SYSTEM "../DTD/ALFS.dtd" [
<!ENTITY % general_entities SYSTEM "../config/general.ent">
<!ENTITY % package_entities SYSTEM "../config/package.ent">

%general_entities;
%package_entities;
]>

<alfs>

<package name="nALFS" version="&nALFS-version;">
	<stage name="Unpacking.">
		<unpack>
			<digest>&nALFS-md5;</digest>
			<archive>&packages_dir;/&nALFS-package;</archive>
			<destination>&build_dir;</destination>
		</unpack>
	</stage>

	<stage name="Installing.">
		<stageinfo>
			<base>&build_dir;/&nALFS-directory;</base>
		</stageinfo>

		<configure>
			<param>--prefix=/usr</param>
		</configure>

		<make />

		<make>
			<param>install</param>
		</make>
	</stage>

	<stage name="Cleaning up.">
		<remove>&build_dir;/&nALFS-directory;</remove>
	</stage>
</package>

</alfs>
