<?xml version="1.0" encoding="iso-8859-1"?>
<!DOCTYPE alfs SYSTEM "../DTD/ALFS.dtd"
[
<!ENTITY % general_entities SYSTEM "../config/general.ent">
<!ENTITY % package_entities SYSTEM "../config/package.ent">

%general_entities;
%package_entities;
]>
<alfs>
  <package name="gcc-pass2" version="&gcc-version;">
    <stage name="Download and Check">
      <download>
	<file>&gcc-package;</file>
	<url>&gcc-package-url;</url>
	<destination>&packages_dir;</destination>
	<digest>&gcc-md5;</digest>
      </download>
      <download>
	<file>&gcc-specs-patch;</file>
	<url>&gcc-patches-url;</url>
	<destination>&packages_dir;</destination>
	<digest>&gcc-specs-patch-md5;</digest>
      </download>
    </stage>
    <stage name="Unpacking">
      <unpack>
        <archive>&packages_dir;/&gcc-package;</archive>
        <destination>&build_dir;</destination>
      </unpack>
      <mkdir base="&build_dir;">
        <option>parents</option>
        <name>gcc-build</name>
      </mkdir>
    </stage>
      <!-- Run the following command:  expect -c "spawn ls"
If you receive the message:
        The system has no more ptys.  Ask your system administrator to create more.
Your host distribution is not set up for proper PTY operation. In this case there is no point in running the test
suites for GCC and Binutils until you are able to resolve the issue.
      -->
    <stage name="Patching">
      <stageinfo>
        <environment>
          <variable name="CFLAGS" />
          <variable name="CXXFLAGS" />
        </environment>
        <base>&build_dir;/&gcc-directory;</base>
      </stageinfo>
      <copy>
       <source>gcc/Makefile.in</source>
       <destination>gcc/Makefile.in.orig</destination>
      </copy>
      <execute command="sed">
        <param>'s@\./fixinc\.sh@-c true@'</param>
        <param>gcc/Makefile.in.orig &gt; gcc/Makefile.in</param>
      </execute>
      <copy>
	<source>gcc/Makefile.in</source>
	<destination>gcc/Makefile.in.tmp</destination>
      </copy>
      <execute command="sed">
        <param>'s/^XCFLAGS =$/&real-amp; -fomit-frame-pointer/'</param>
        <param>gcc/Makefile.in.tmp &gt; gcc/Makefile.in</param>
      </execute>
      <patch>
        <param>-N</param>
        <param>-p1</param>
        <param>-i &packages_dir;/&gcc-specs-patch;</param>
      </patch>
    </stage>
    <stage name="Installing">
      <stageinfo>
        <environment>
          <variable name="CFLAGS" />
          <variable name="CXXFLAGS" />
        </environment>
        <base>&build_dir;/gcc-build</base>
      </stageinfo>

      <configure command="../&gcc-directory;/configure">
        <param>--prefix=/tools</param>
        <param>--with-local-prefix=/tools</param>
        <param>--enable-clocale=gnu</param>
        <param>--enable-shared</param>
        <param>--enable-threads=posix</param>
        <param>--enable-__cxa_atexit</param>
        <param>--enable-languages=c,c++</param>
        <param>--disable-libstdcxx-pch</param>
      </configure>
      <make>
        <param>&jlevel;</param>
      </make>
      <!--
      <make>
        <param>-k check</param>
      </make>
      <execute command="../&gcc-directory;/contrib/test_summary" />
      -->
      <make>
        <param>install</param>
      </make>
    </stage>
    <stage name="Cleanup">
      <remove>&build_dir;/&gcc-directory;</remove>
      <remove>&build_dir;/gcc-build</remove>
    </stage>
  </package>
</alfs>
