<?xml version="1.0" encoding="iso-8859-1"?>
<!DOCTYPE alfs SYSTEM "../../DTD/ALFS.dtd"
[
<!ENTITY % general_entities SYSTEM "../../config/general.ent">
<!ENTITY % package_entities SYSTEM "../../config/packages/ch12.ent">
<!ENTITY % config_entities SYSTEM  "../../config/config.ent">

%general_entities;
%package_entities;
%config_entities;

]>
<alfs>
  <package name="Digest-BubbleBabble" version="&Digest-BubbleBabble-version;">
    <stage name="Unpacking">
      <unpack>
      	<digest>&Digest-BubbleBabble-md5;</digest>
        <archive>&packages_dir;/&Digest-BubbleBabble-package;</archive>
        <destination>&build_dir;</destination>
      </unpack>
    </stage>
    <stage name="Installing">
      <stageinfo>
        <base>&build_dir;/&Digest-BubbleBabble-directory;</base>
      </stageinfo>
      <execute command="perl Makefile.PL" />
      <make />
      <make>
        <param>test</param>
      </make>
      <make>
        <param>install</param>
      </make>
    </stage>
    <stage name="Cleanup">
      <remove>&build_dir;/&Digest-BubbleBabble-directory;</remove>
    </stage>
  </package>
</alfs>
