<?xml version="1.0" encoding="iso-8859-1"?>
<!DOCTYPE alfs SYSTEM "../DTD/ALFS.dtd"
[
<!ENTITY % general_entities SYSTEM "../config/general.ent">
<!ENTITY % package_entities SYSTEM "../config/package.ent">

%general_entities;
%package_entities;
]>
<alfs>
  <package name="procps" version="&procps-version;">
    <stage name="Download and Check">
      <download>
	<file>&procps-package;</file>
	<url>&procps-package-url;</url>
	<destination>&packages_dir;</destination>
	<digest>&procps-md5;</digest>
      </download>
    </stage>
    <stage name="Unpacking">
      <unpack>
        <archive>&packages_dir;/&procps-package;</archive>
        <destination>&build_dir;</destination>
      </unpack>
    </stage>
    <stage name="Installing">
      <stageinfo>
        <base>&build_dir;/&procps-directory;</base>
      </stageinfo>
      <make>
        <param>&jlevel;</param>
      </make>
      <make>
        <param>install</param>
      </make>
    </stage>
    <stage name="Cleanup">
      <remove>&build_dir;/&procps-directory;</remove>
    </stage>
  </package>
</alfs>
