<?xml version="1.0" encoding="iso-8859-1"?>
<!DOCTYPE alfs SYSTEM "../DTD/ALFS.dtd"
[
<!ENTITY % general_entities SYSTEM "../config/general.ent">
<!ENTITY % package_entities SYSTEM "../config/packages/ch18.ent">
<!ENTITY % config_entities SYSTEM  "../config/config.ent">

%general_entities;
%package_entities;
%config_entities;

]>
<alfs>
  <package name="inetutils" version="&inetutils-version;">
    <packageinfo>
      <utilizes>
        <name>linuxpam</name>
      </utilizes>
      <utilizes>
        <name>tcpwrappers</name>
      </utilizes>
      <utilizes>
	<name>krb4</name>
      </utilizes>
      <utilizes>
	<name>&krb-impl;</name>
      </utilizes>
    </packageinfo>
    <stage name="Unpacking">
      <stageinfo>
	<user>&build-user;</user>
      </stageinfo>
      <unpack>
        <digest>&inetutils-md5;</digest>
	<archive>&packages_dir;/&inetutils-package;</archive>
        <destination>&build_dir;</destination>
      </unpack>
    </stage>
    <stage name="Patching">
      <stageinfo>
	<user>&build-user;</user>
	<base>&build_dir;/&inetutils-directory;</base>
      </stageinfo>
      <patch>
	<param>-N</param>
	<param>-p1</param>
	<param>-i &packages_dir;/&inetutils-kernel-header-patch;</param>
      </patch>
    </stage>
    <stage name="Building">
      <stageinfo>
	<user>&build-user;</user>
        <base>&build_dir;/&inetutils-directory;</base>
      </stageinfo>
      <configure>
        <param>--prefix=/usr</param>
	<param>--libexecdir=/usr/sbin</param>
	<param>--sysconfdir=/etc</param>
	<param>--localstatedir=/var</param>
	<param>--mandir=/usr/share/man</param>
        <param>--infodir=/usr/share/info</param>
	<param>--disable-logger</param>
	<param>--disable-syslogd</param>
      </configure>
      <make />
    </stage>
    <stage name="Installing">
      <stageinfo>
	<base>&build_dir;/&inetutils-directory;</base>
      </stageinfo>
      <make>
        <param>install</param>
      </make>
      <move>
        <source>/usr/bin/ping</source>
        <destination>/bin</destination>
      </move>
    </stage>
    <stage name="Cleanup">
      <remove>&build_dir;/&inetutils-directory;</remove>
    </stage>
  </package>
</alfs>
