<?xml version="1.0" encoding="iso-8859-1"?>
<!DOCTYPE alfs SYSTEM "../DTD/ALFS.dtd"
[
<!ENTITY % general_entities SYSTEM "../config/general.ent">
<!ENTITY % package_entities SYSTEM "../config/package.ent">
<!ENTITY % config_entities SYSTEM "../config/config.ent">

%general_entities;
%package_entities;
%config_entities;
]>
<alfs>
  <package name="findutils" version="&findutils-version;">
    <stage name="Unpacking">
      <unpack>
        <digest>&findutils-md5;</digest>
        <archive>&packages_dir;/&findutils-package;</archive>
        <destination>&build_dir;</destination>
      </unpack>
    </stage>
    <stage name="Installing">
      <stageinfo>
        <base>&build_dir;/&findutils-directory;</base>
      </stageinfo>
      <configure>
        <param>--prefix=/usr</param>
        <param>--libexecdir=/usr/lib/locate</param>
        <param>--localstatedir=/var/lib/locate</param>
      </configure>
      <make>
        <param>&jlevel;</param>
      </make>
      <!--
      <make>
        <param>check</param>
      </make>
      -->
      <make>
        <param>install</param>
      </make>
    </stage>
    <stage name="Cleanup">
      <remove>&build_dir;/&findutils-directory;</remove>
    </stage>
  </package>
</alfs>
