<?xml version="1.0" encoding="iso-8859-1"?>
<!DOCTYPE alfs SYSTEM "../DTD/ALFS.dtd"
[
<!ENTITY % general_entities SYSTEM "../config/general.ent">
<!ENTITY % package_entities SYSTEM "../config/packages/ch08.ent">
<!ENTITY % config_entities SYSTEM  "../config/config.ent">

%general_entities;
%package_entities;
%config_entities;

]>
<alfs>
  <package name="libglade" version="&libglade-version;">
    <packageinfo>
      <requires>
        <name>libxml2</name>
      </requires>
      <requires>
        <name>gtk+2</name>
      </requires>
      <utilizes>
        <name>python</name>
      </utilizes>
      <utilizes>
        <name>gtk-doc</name>
      </utilizes>
    </packageinfo>
    <stage name="Unpacking">
      <stageinfo>
	<user>&build-user;</user>
      </stageinfo>
      <unpack>
        <digest>&libglade-md5;</digest>
	<archive>&packages_dir;/&libglade-package;</archive>
        <destination>&build_dir;</destination>
      </unpack>
    </stage>
    <stage name="Building">
      <stageinfo>
	<user>&build-user;</user>
	<base>&build_dir;/&libglade-directory;</base>
      </stageinfo>
      <configure>
	<param>--prefix=/usr</param>
      </configure>
      <make />
    </stage>
    <stage name="Installing">
      <stageinfo>
	<base>&build_dir;/&libglade-directory;</base>
      </stageinfo>
      <make>
	<param>install</param>
      </make>
      &ldconfig;
    </stage>
    <stage name="Cleanup">
      <remove>&build_dir;/&libglade-directory;</remove>
    </stage>
  </package>
</alfs>
