<?xml version="1.0" encoding="iso-8859-1"?>
<!DOCTYPE alfs SYSTEM "../DTD/ALFS.dtd"
[
<!ENTITY % general_entities SYSTEM "../config/general.ent">
<!ENTITY % package_entities SYSTEM "../config/packages/ch39.ent">
<!ENTITY % config_entities SYSTEM  "../config/config.ent">

%general_entities;
%package_entities;
%config_entities;

]>
<alfs>
  <package name="xine-ui" version="&xine-ui-version;">
    <packageinfo>
      <requires>
        <name>xine-lib</name>
      </requires>
      <utilizes>
        <name>curl</name>
      </utilizes>
      <utilizes>
        <name>aalib</name>
      </utilizes>
    </packageinfo>
    <stage name="Unpacking">
      <unpack>
        <archive>&packages_dir;/&xine-ui-package;</archive>
        <destination>&build_dir;</destination>
      </unpack>
    </stage>
    <stage name="Installing">
      <stageinfo>
        <base>&build_dir;/&xine-ui-directory;</base>
      </stageinfo>
      <configure>
        <param>--prefix=/usr</param>
      </configure>
      <make />
      <make>
        <param>install</param>
      </make>
    </stage>
    <stage name="Cleanup">
      <remove>&build_dir;/&xine-ui-directory;</remove>
    </stage>
  </package>
</alfs>
