<?xml version="1.0" encoding="iso-8859-1"?>
<!DOCTYPE alfs SYSTEM "../DTD/ALFS.dtd"
[
<!ENTITY % general_entities SYSTEM "../config/general.ent">
<!ENTITY % package_entities SYSTEM "../config/packages/ch31.ent">
<!ENTITY % config_entities SYSTEM  "../config/config.ent">

%general_entities;
%package_entities;
%config_entities;

]>
<alfs>
  <package name="gnome-mag" version="&gnome-mag-version;">
    <packageinfo>
      <requires>
        <name>libgail-gnome</name>
      </requires>
      <utilizes>
	<name>Xdamage</name>
      </utilizes>
    </packageinfo>
    <stage name="Unpacking">
      <unpack>
        <archive>&packages_dir;/&gnome-mag-package;</archive>
        <destination>&build_dir;</destination>
      </unpack>
    </stage>
    <stage name="Installing">
      <stageinfo>
        <base>&build_dir;/&gnome-mag-directory;</base>
      </stageinfo>
      <configure>
        <param>--prefix=`pkg-config --variable=prefix ORBit-2.0`</param>
      </configure>
      <make />
      <make>
        <param>install</param>
      </make>
    </stage>
    <stage name="Cleanup">
      <remove>&build_dir;/&gnome-mag-directory;</remove>
    </stage>
  </package>
</alfs>
