<?xml version="1.0" encoding="iso-8859-1"?>
<!DOCTYPE alfs SYSTEM "../DTD/ALFS.dtd"
[
<!ENTITY % general_entities SYSTEM "../config/general.ent">
<!ENTITY % package_entities SYSTEM "../config/packages/ch30.ent">
<!ENTITY % config_entities SYSTEM  "../config/config.ent">

%general_entities;
%package_entities;
%config_entities;

]>
<alfs>
  <package name="libbonoboui" version="&libbonoboui-version;">
    <packageinfo>
      <requires>
        <name>libgnome</name>
      </requires>
      <requires>
        <name>libgnomecanvas</name>
      </requires>
      <utilizes>
        <name>gtk-doc</name>
      </utilizes>
    </packageinfo>
    <stage name="Unpacking">
      <unpack>
        <archive>&packages_dir;/&libbonoboui-package;</archive>
        <destination>&build_dir;</destination>
      </unpack>
    </stage>
    <stage name="Installing">
      <stageinfo>
	<base>&build_dir;/&libbonoboui-directory;</base>
      </stageinfo>
      <configure>
	<param>--prefix=`pkg-config --variable=prefix ORBit-2.0`</param>
      </configure>
      <make />
      <make>
	<param>install</param>
      </make>
      <search_replace>
	<file>&gnome-prefix;/lib/bonobo/servers/Bonobo_Sample_Controls.server</file>
	<find>/gnome/head/INSTALL</find>
	<replace>&gnome-prefix;</replace>
      </search_replace>
      &ldconfig;
    </stage>
    <stage name="Cleanup">
      <remove>&build_dir;/&libbonoboui-directory;</remove>
    </stage>
  </package>
</alfs>
